text,label
" Presentation The two arches surround the esophagus and trachea which, if sufficiently constrictive, may cause breathing or swallowing difficulties despite medical therapies.",0
A less common ring is present with a right aortic arch instead of the usual left-sided aortic arch.,0
This compresses the esophagus and trachea because of the persistence of a ductal ligament (from fetal circulation) that may connect between the aorta on the front and the left subclavian artery posteriorly going to the left arm.,0
" Diagnosis Infants with vascular rings typically present before 12 months with respiratory or esophageal symptoms like stridor, wheezing, cough, dysphagia, or difficulty feeding.",0
"The stridor improves with neck extension, differentiating from laryngomalacia which is relieved by prone or upright positioning, and will not be relieved with corticosteroids or epinephrine, unlike croup.",0
"Diagnosis requires a high degree of clinical suspicion and can be confirmed with barium contrast esophagogram for those with esophageal symptoms, bronchoscopy, or CT or MRI.",0
Posterior urethral valve (PUV) disorder is an obstructive developmental anomaly in the urethra and genitourinary system of male newborns.,0
A posterior urethral valve is an obstructing membrane in the posterior male urethra as a result of abnormal in utero development.,0
It is the most common cause of bladder outlet obstruction in male newborns.,0
"The disorder varies in degree, with mild cases presenting late due to milder symptoms.",0
"More severe cases can have renal and respiratory failure from lung underdevelopment as result of low amniotic fluid volumes, requiring intensive care and close monitoring.",0
It occurs in about one in 8000 babies.,0
" Presentation  Complications Incontinence Urinary tract infection Renal failure Vesicoureteral reflux Chronic kidney disease Diagnosis Abdominal ultrasound is of some benefit, but not diagnostic.",0
" Features that suggest posterior urethral valves are bilateral hydronephrosis, a thickened bladder wall with thickened smooth muscle trabeculations, and bladder diverticula.Voiding cystourethrogram (VCUG) is more specific for the diagnosis.",0
Normal plicae circularis are variable in appearance and often not seen on normal VCUGs.,0
" PUV on voiding cystourethrogram is characterized by an abrupt tapering of urethral caliber near the verumontanum, with the specific level depending on the developmental variant.",0
Vesicoureteral reflux is also seen in over 50% of cases.,0
Very often the posterior urethra maybe dilated thus making the abrupt narrowing more obvious.,0
"the bladder wall may show trabeculations or sacculations or even diverticuli.Diagnosis can also be made by cystoscopy, where a small camera is inserted into the urethra for direct visualization of the posteriorly positioned valve.",0
"A limitation of this technique is that posterior valve tissue is translucent and can be pushed against the wall of the urethra by inflowing irrigation fluid, making it difficult to visualize.",0
Cystoscopy may also demonstrate the bladder changes.,0
"Centers in Europe and Japan have also had excellent results with cystosonography, although it has not been approved for use in the United States yet.",0
 Classification Posterior urethral obstruction was first classified by H.,0
H.,0
Young in 1919.,0
" The verumontanum, or mountain ridge, is a distinctive landmark in the prostatic urethra, important in the systemic division of posterior valve disorders:Type I - Most common type; due to anterior fusing of the plicae colliculi, mucosal fins extending from the bottom of the verumontanum distally along the prostatic and membranous urethra Type II - Least common variant; vertical or longitudinal folds between the verumontanum and proximal prostatic urethra and bladder neck Type III - Less common variant; a disc of tissue distal to verumontanum, also theorized  to be a developmental anomaly of congenital urogenital remnants in the bulbar urethraDewan has suggested that obstruction in the posterior urethra is more appropriately termed congenital obstructions of the posterior urethral membrane (COPUMs), a concept that has come from an in-depth analysis of the historical papers, and evaluation of patients with a prenatal diagnosis that has facilitated video recording of the uninstrumented obstructed urethra.",0
"The congenital obstructive lesions in the bulbar urethra, named Type III Valves by Young in 1919, have been eponymously referred to as Cobb's collar or Moorman's ring.",0
"For each of the COPUM (Posterior Urethra) and Cobb's (Bulbar Urethra) lesions, the degree of obstruction can be variable, consistent with a variable expression of the embryopathy.",0
" The now nearly one hundred year old nomenclature of posterior urethral valves was based on limited radiology and primitive endoscopy, thus a change COPUM or Cobb's has been appropriate.",0
" Treatment If suspected antenatally, a consultation with a paediatric surgeon/ paediatric urologist maybe indicated to evaluate the risk and consider treatment options.",0
Treatment is by endoscopic valve ablation.,0
"Fetal surgery is a high risk procedure reserved for cases with severe oligohydramnios, to try to limit the associated lung underdevelopment, or pulmonary hypoplasia, that is seen at birth in these patients.",0
"The risks of fetal surgery are significant and include limb entrapment, abdominal injury, and fetal or maternal death.",0
"Specific procedures for in utero intervention include infusions of amniotic fluid, serial bladder aspiration, and creating a connection between the amniotic sac and the fetal bladder, or vesicoamniotic shunt.There are three specific endoscopic treatments of posterior urethral valves:  Vesicostomy followed by valve ablation - a stoma, or hole, is made in the urinary bladder, also known as low diversion, after which the valve is ablated and the stoma is closed.",0
"Pyelostomy followed by valve ablation -  stoma is made in the pelvis of the kidney as a slightly high diversion, after which the valve is ablated and the stoma is closed Primary (transurethral) valve ablation - the valve is removed through the urethra without creation of a stomaThe standard treatment is primary (transurethral) ablation of the valves.",0
"Urinary diversion is used in selected cases, and its benefit is disputed.Following surgery, the follow-up in patients with posterior urethral valve syndrome is long term, and often requires a multidisciplinary effort between paediatric surgeons/ paediatric urologists, paediatric nephrologists, pulmonologists, neonatologists, radiologists and the family of the patient.",0
"Care must be taken to  promote proper bladder compliance and renal function, as well as to monitor and treat the significant lung underdevelopment that can accompany the disorder.",0
Definitive treatment may also be indicated for the vesico-ureteral reflux.,0
 Female homolog The female homolog to the male verumontanum from which the valves originate is the hymen.,0
"Eye black is a grease or strip applied under the eyes to reduce glare, although studies have not conclusively proven this.",0
It is a form of functional makeup.,0
"It is often used by American football, baseball and lacrosse players to purportedly mitigate the effects of bright sunlight or stadium floodlights.",0
"However, in comparison, many other nations play similar sports, such as Rugby, Australian Rules Football, Soccer/Association Football, and Cricket, under stadium floodlights or outdoors without the players wearing any eye black, adhesive eye black stickers, or other form of functional makeup.",0
"The wearing of eye black almost uniquely by American sports players appears to have more to do with aesthetics as journalist Paul Lukas, former writer for ESPN.com notes, ...let's be honest: glare, shmare.",0
"The real reason everyone loves to wear eye black is that it looks totally cool, like modern war paint...",0
" Varieties Traditional grease consists of beeswax, paraffin, and carbon black.",0
Anti-glare face strips that emulate the grease are also commonly used.,0
" History One of the earliest known instances of a player wearing eye black is baseball legend Babe Ruth, who, in or around the 1930s, used the grease in an attempt to reduce sun glare.",0
"According to Paul Lukas of ESPN.com, eye black caught on with American football player Andy Farkas.",0
He also states that the original eye black was made from the ashes of burned cork.,0
 2003 study A 2003 study by Brian DeBroff and Patricia Pahk tested whether black eye grease actually had anti-glare properties.,0
" The subjects of the study were divided into three groups: wearers of eye black, wearers of anti-glare stickers, and wearers of petroleum jelly.",0
The subjects' vision was tested using an eye chart while being exposed to natural sunlight.,0
"The study concluded that eye black reduced glare of the sun and improved contrast sensitivity, whereas commercial anti-glare stickers and petroleum jelly (the control substance) were found to be ineffective.However, the study was subject to unavoidable demand bias, wherein the test subjects could have unconsciously changed their responses during testing based on the fact that they knew which substance they were wearing.",0
"Also, the petroleum jelly could have introduced glare that would not occur on natural skin and the study did not test a control condition of natural skin.",0
Learning bias is also a factor in the results due to chart repetition.,0
 New Hampshire study A study by Benjamin R.,0
"Powers at University of New Hampshire, which improved on DeBroff's methodology, found eye black to reduce glare from the sun in women and in those whose eye-color was not blue.",0
The study also tested males and blue-eyed subjects.,0
"However, the results were not statistically significant (probably due to a smaller sample size of those test subjects).",0
Some testing was also performed indoors under artificial lighting (when inclement weather prohibited outdoor testing).,0
"However, those results showed little difference and were not statistically significant.",0
The Powers study was not a double-blind study because those in contact with the test subjects knew which substance was applied.,0
"Also, the eye tests were performed at a distance of only 1.15 metres (3 ft 9 in).",0
" MythBusters test On an episode of MythBusters, Adam Savage and Jamie Hyneman tested whether eye black reduces glare.",0
"They determined that, while eye black does not eliminate glare, it does improve an athlete's ability to differentiate between light and dark, enhancing a player's ability to track moving objects in a sunny environment.",0
" Messages in eye black Some athletes, particularly at the college level, began a practice of writing short messages on their adhesive eye black stickers.",0
"The trend gained traction among football players in the mid-2000s, popularized by Reggie Bush, who featured homages to his hometown; other popular messages included Bible verses, memorial tributes, and licensed university logos.",0
"The displays began to garner widespread media attention surrounding Tim Tebow, who used Bible verse references.",0
"Polycystic kidney disease (PKD or PCKD, also known as polycystic kidney syndrome) is a genetic disorder in which the renal tubules become structurally abnormal, resulting in the development and growth of multiple cysts within the kidney.",0
"These cysts may begin to develop in utero, in infancy, in childhood, or in adulthood.",0
"Cysts are non-functioning tubules filled with fluid pumped into them, which range in size from microscopic to enormous, crushing adjacent normal tubules and eventually rendering them non-functional as well.",0
PKD is caused by abnormal genes that produce a specific abnormal protein; this protein has an adverse effect on tubule development.,0
"PKD is a general term for two types, each having their own pathology and  genetic cause: autosomal dominant polycystic kidney disease (ADPKD) and autosomal recessive polycystic kidney disease (ARPKD).",0
"The abnormal gene exists in all cells in the body; as a result, cysts may occur in the liver, seminal vesicles, and pancreas.",0
"This genetic defect can also cause aortic root aneurysms, and aneurysms in the circle of Willis cerebral arteries, which if they rupture, can cause a subarachnoid hemorrhage.",0
"Diagnosis may be suspected from one, some, or all of the following: new onset flank pain or red urine; a positive family history; palpation of enlarged kidneys on physical exam; an incidental finding on abdominal sonogram; or an incidental finding of abnormal kidney function on routine lab work (BUN, serum creatinine, or eGFR).",0
Definitive diagnosis is made by abdominal CT exam.,0
"Complications include hypertension due to the activation of the renin‚Äìangiotensin‚Äìaldosterone system (RAAS), frequent cyst infections, urinary bleeding, and declining renal function.",0
Hypertension is treated with angiotensin converting enzyme inhibitors (ACEIs) or angiotensin receptor blockers (ARBs).,0
Infections are treated with antibiotics.,0
Declining renal function is treated with renal replacement therapy (RRT): dialysis and/or transplantation.,0
 Management from the time of the suspected or definitive diagnosis is by a board-certified nephrologist.,0
" Signs and symptoms Signs and symptoms include high blood pressure, headaches, abdominal pain, blood in the urine, and excessive urination.",0
"Other symptoms include pain in the back, and cyst formation (renal and other organs).",0
 Cause PKD is caused by abnormal genes which produce a specific abnormal protein which has an adverse effect on tubule development.,0
 Autosomal dominant Autosomal dominant polycystic kidney disease (ADPKD) is the most common of all the inherited cystic kidney diseases with an incidence of 1:500 live births.,0
Studies show that 10% of end-stage kidney disease (ESKD) patients being treated with dialysis in Europe and the U.S.,0
"were initially diagnosed and treated for ADPKD.Genetic mutations in any of the three genes PKD1, PKD2, and PKD3 have similar phenotypical presentations.",0
" Gene PKD1 is located on chromosome 16 and codes for a protein involved in regulation of cell cycle and intracellular calcium transport in epithelial cells, and is responsible for 85% of the cases of ADPKD.",0
"A group of voltage-linked cation channels, with inward selectivity for K>Na>>Ca and outward selectivity for Ca2+‚Äâ‚âà‚ÄâBa2+‚Äâ>‚ÄâNa+‚Äâ‚âà K+, are coded for by PKD2 on chromosome 4 PKD3 recently appeared in research papers as a postulated third gene.",0
Fewer than 10% of cases of ADPKD appear in non-ADPKD families.,0
"Cyst formation begins in utero from any point along the nephron, although fewer than 5% of nephrons are thought to be involved.",0
"As the cysts accumulate fluid, they enlarge, separate entirely from the nephron, compress the neighboring kidney parenchyma, and progressively compromise kidney function.",0
" Autosomal recessive Autosomal recessive polycystic kidney disease (ARPKD) (OMIM #263200) is the lesser common of the two types of PKD, with an incidence of 1:20,000 live births and is typically identified in the first few weeks after birth.",0
"Unfortunately, the kidneys are often underdeveloped resulting in a 30% death rate in newborns with ARPKD.",0
PKHD1 is involved.,0
 Mechanism Both autosomal dominant and autosomal recessive polycystic kidney disease cyst formation are tied to abnormal cilia-mediated signaling.,0
The polycystin-1 and polycystin-2 proteins appear to be involved in both autosomal dominant and recessive polycystic kidney disease due to defects in both proteins.,0
"Both proteins have communication with calcium channel proteins, and causes reduction in resting (intracellular) calcium and endoplasmic reticulum storage of calcium.The disease is characterized by a ‚Äòsecond hit‚Äô phenomenon, in which a mutated dominant allele is inherited from a parent, with cyst formation occurring only after the normal, wild-type gene sustains a subsequent second genetic ‚Äòhit‚Äô, resulting in renal tubular cyst formation and disease progression.PKD results from defects in the primary cilium, an immotile, hair-like cellular organelle present on the surface of most cells in the body, anchored in the cell body by the basal body.",0
"In the kidney, primary cilia have been found to be present on most cells of the nephron, projecting from the apical surface of the renal epithelium into the tubule lumen.",0
"The cilia were believed to bend in the urine flow, leading to changes in signalling, however this has since been shown to be an experimental error (the bending of cilia was an artifact of focal plane compensation, and also the actual effect on micturition by severe hypertension and cardiac arrest) and that bending of cilia does not contribute to alterations in Ca flux.",0
"While it is not known how defects in the primary cilium lead to cyst development, it is thought to possibly be related to disruption of one of the many signaling pathways regulated by the primary cilium, including intracellular calcium, Wnt/Œ≤-catenin, cyclic adenosine monophosphate (cAMP), or planar cell polarity (PCP).",0
"Function of the primary cilium is impaired, resulting in disruption of a number of intracellular signaling cascades which produce differentiation of cystic epithelium, increased cell division, increased apoptosis, and loss of resorptive capacity.",0
" Diagnosis Polycystic kidney disease can be ascertained via a CT scan of abdomen, as well as, an MRI and ultrasound of the same area.",0
"A physical exam/test can reveal enlarged liver, heart murmurs and elevated blood pressure Natural history Most cases progress to bilateral disease in adulthood.",0
 Treatment There is no FDA-approved treatment.,0
"However, recent research indicates that mild to moderate dietary restrictions slow the progression of autosomal dominant polycystic kidney disease (ADPKD) in mice.If and when the disease progresses enough in a given case, the nephrologist or other practitioner and the patient will have to decide what form of renal replacement therapy will be used to treat end-stage kidney disease (kidney failure, typically stage 4 or 5 of chronic kidney disease).That will either be some form of dialysis, which can be done at least two different ways at varying frequencies and durations (whether it is done at home or in the clinic depends on the method used and the patient's stability and training) and eventually, if they are eligible because of the nature and severity of their condition and if a suitable match can be found, unilateral or bilateral kidney transplantation.A Cochrane Review study of autosomal dominant polycystic kidney disease made note of the fact that it is important at all times, while avoiding antibiotic resistance, to control infections of the cysts in the kidneys, and if affected, the liver, when needed for a certain duration to combat infection, by using, bacteriostatic and bacteriocidal drugs.",0
" Prognosis ADPKD individuals might have a normal life; conversely, ARPKD can cause kidney dysfunction and can lead to kidney failure by the age of 40‚Äì60.",0
"ADPKD1 and ADPKD2 are very different, in that ADPKD2 is much milder.Currently, there are no therapies proven effective to prevent the progression of ADPKD.",0
" Epidemiology PKD is one of the most common hereditary diseases in the United States, affecting more than 600,000 people.",0
It is the cause of nearly 10% of all end-stage renal disease.,0
"It equally affects men, women, and all races.",0
PKD occurs in some animals as well as humans.,0
"Dermatitis, also known as eczema, is a group of diseases that result in inflammation of the skin.",0
"These diseases are characterized by itchiness, red skin and a rash.",0
"In cases of short duration, there may be small blisters, while in long-term cases the skin may become thickened.",0
"The area of skin involved can vary from small to covering the entire body.Dermatitis includes atopic dermatitis, allergic contact dermatitis, irritant contact dermatitis and stasis dermatitis.",0
The exact cause of the condition is often unclear.,0
"Cases may involve a combination of irritation, allergy and poor venous return.",0
The type of dermatitis is generally determined by the person's history and the location of the rash.,0
"For example, irritant dermatitis often occurs on the hands of those who frequently get them wet.",0
"Allergic contact dermatitis occurs upon exposure to an allergen, causing a hypersensitivity reaction in the skin.Treatment of atopic dermatitis is typically with moisturizers and steroid creams.",0
"The steroid creams should generally be of mid- to high strength and used for less than two weeks at a time, as side effects can occur.",0
Antibiotics may be required if there are signs of skin infection.,0
Contact dermatitis is typically treated by avoiding the allergen or irritant.,0
Antihistamines may help with sleep and decrease nighttime scratching.Dermatitis was estimated to affect 245 million people globally in 2015.,0
Atopic dermatitis is the most common type and generally starts in childhood.,0
"In the United States, it affects about 10‚Äì30% of people.",0
Contact dermatitis is twice as common in females than males.,0
Allergic contact dermatitis affects about 7% of people at some point in their lives.,0
"Irritant contact dermatitis is common, especially among people with certain occupations; exact rates are unclear.",0
 Signs and symptoms Dermatitis symptoms vary with all different forms of the condition.,0
They range from skin rashes to bumpy rashes or including blisters.,0
"Although every type of dermatitis has different symptoms, there are certain signs that are common for all of them, including redness of the skin, swelling, itching and skin lesions with sometimes oozing and scarring.",0
"Also, the area of the skin on which the symptoms appear tends to be different with every type of dermatitis, whether on the neck, wrist, forearm, thigh or ankle.",0
"Although the location may vary, the primary symptom of this condition is itchy skin.",0
"More rarely, it may appear on the genital area, such as the vulva or scrotum.",0
Symptoms of this type of dermatitis may be very intense and may come and go.,0
Irritant contact dermatitis is usually more painful than itchy.,0
"Although the symptoms of atopic dermatitis vary from person to person, the most common symptoms are dry, itchy, red skin.",0
"Typical affected skin areas include the folds of the arms, the back of the knees, wrists, face and hands.",0
"Perioral dermatitis refers to a red bumpy rash around the mouth.Dermatitis herpetiformis symptoms include itching, stinging and a burning sensation.",0
Papules and vesicles are commonly present.,0
"The small red bumps experienced in this type of dermatitis are usually about 1 cm in size, red in color and may be found symmetrically grouped or distributed on the upper or lower back, buttocks, elbows, knees, neck, shoulders, and scalp.",0
"Less frequently, the rash may appear inside the mouth or near the hairline.",0
"The symptoms of seborrheic dermatitis, on the other hand, tend to appear gradually, from dry or greasy scaling of the scalp (dandruff) to scaling of facial areas, sometimes with itching, but without hair loss.",0
" In newborns, the condition causes a thick and yellowish scalp rash, often accompanied by a diaper rash.",0
"In severe cases, symptoms may appear along the hairline, behind the ears, on the eyebrows, on the bridge of the nose, around the nose, on the chest, and on the upper back.",0
" Environmental The hygiene hypothesis postulates that the cause of asthma, eczema, and other allergic diseases is an unusually clean environment in childhood which leads to an insufficient human microbiota.",0
It is supported by epidemiologic studies for asthma.,0
"The hypothesis states that exposure to bacteria and other immune system modulators is important during development, and missing out on this exposure increases the risk for asthma and allergy.",0
"While it has been suggested that eczema may sometimes be an allergic reaction to the excrement from house dust mites, with up to 5% of people showing antibodies to the mites, the overall role this plays awaits further corroboration.",0
" Genetic A number of genes have been associated with eczema, one of which is filaggrin.",0
"Genome-wide studies found three new genetic variants associated with eczema: OVOL1, ACTL9 and IL4-KIF3A.Eczema occurs about three times more frequently in individuals with celiac disease and about two times more frequently in relatives of those with celiac disease, potentially indicating a genetic link between the conditions.",0
 Pathophysiology Eczema can be characterized by spongiosis which allows inflammatory mediators to accumulate.,0
"Different dendritic cells sub types, such as Langerhans cells, inflammatory dendritic epidermal cells and plasmacytoid dendritic cells have a role to play.",0
 Diagnosis Diagnosis of eczema is based mostly on the history and physical examination.,0
"In uncertain cases, skin biopsy may be taken for a histopathologic diagnosis of dermatitis.",0
Those with eczema may be especially prone to misdiagnosis of food allergies.Patch tests are used in the diagnosis of allergic contact dermatitis.,0
 Classification The term eczema refers to a set of clinical characteristics.,0
"Classification of the underlying diseases has been haphazard with numerous different classification systems, and many synonyms being used to describe the same condition.",0
