text,label
"Acne conglobata is a highly inflammatory disease presenting with comedones, nodules, abscesses, and draining sinus tracts.This condition generally begins between the ages of 18 and 30.",0
"It usually persists for a very long time, and often until the patient is around 40 years old.",0
" Although it often occurs where there is already an active acne problem, it can also happen to people whose acne has subsided.",0
" Although the cause of this type of acne is unknown, it is associated with testosterone and thus appears mainly in men.",0
 It can be caused by anabolic steroid abuse and sometimes appears in men after stopping testosterone therapy.,0
" It can also happen to someone who has a tumor that is releasing large amounts of androgens, or to people in remission from diseases, such as leukemia.",0
"In certain persons, the condition may be triggered by exposure to aromatic hydrocarbons or ingestion of halogens.",0
" Presentation Acne conglobata presents with blackheads appearing around the face, neck, chest, upper arms and buttocks in groups of two or three.",0
Pimples form around the blackheads; they are large and engorged with fluid and may be sensitive to touch.,0
 They remain for a while and continue to grow and fill with pus until they eventually rupture.,0
"After the lesion has drained, it fills up again.",0
"Blood tests allow for hundreds of allergens to be screened from a single sample, and cover food allergies as well as inhalants.",0
"However, non-IgE-mediated allergies cannot be detected by this method.",0
"Other widely promoted tests such as the antigen leukocyte cellular antibody test and the food allergy profile are considered unproven methods, the use of which is not advised.",0
Food challenges test for allergens other than those caused by IgE allergens.,0
"The allergen is given to the person in the form of a pill, so the person can ingest the allergen directly.",0
 The person is watched for signs and symptoms.,0
"The problem with food challenges is that they must be performed in the hospital under careful watch, due to the possibility of anaphylaxis.Food challenges, especially double-blind, placebo-controlled food challenges, are the gold standard for diagnosis of food allergies, including most non-IgE-mediated reactions, but is rarely done.",0
"Blind food challenges involve packaging the suspected allergen into a capsule, giving it to the patient, and observing the patient for signs or symptoms of an allergic reaction.The recommended method for diagnosing food allergy is to be assessed by an allergist.",0
The allergist will review the patient's history and the symptoms or reactions that have been noted after food ingestion.,0
"If the allergist feels the symptoms or reactions are consistent with food allergy, he/she will perform allergy tests.",0
"Additional diagnostic tools for evaluation of eosinophilic or non-IgE mediated reactions include endoscopy, colonoscopy, and biopsy.",0
" Differential diagnosis Important differential diagnoses are:  Lactose intolerance generally develops later in life, but can present in young patients in severe cases.",0
"It is due to an enzyme deficiency (lactase) and not allergy, and occurs in many non-Western people.",0
Celiac disease.,0
"While it is caused by a permanent intolerance to gluten (present in wheat, rye, barley and oats), is not an allergy nor simply an intolerance, but a chronic, multiple-organ autoimmune disorder primarily affecting the small intestine.",0
"Irritable bowel syndrome C1 Esterase inhibitor deficiency (hereditary angioedema), a rare disease, generally causes attacks of angioedema, but can present solely with abdominal pain and occasional diarrhea.",0
" Prevention Breastfeeding for more than four months may prevent atopic dermatitis, cow's milk allergy, and wheezing in early childhood.",0
Early exposure to potential allergens may be protective.,0
"Specifically, early exposure to eggs and peanuts reduces the risk of allergies to these.",0
Guidelines suggest introducing peanuts as early as 4‚Äì6 months and include precautionary measures for high-risk infants.,0
"The former guidelines, advising delaying the introduction of peanuts, are now thought to have contributed to the increase in peanut allergy seen recently.To avoid an allergic reaction, a strict diet can be followed.",0
"It is difficult to determine the amount of allergenic food required to elicit a reaction, so complete avoidance should be attempted.",0
" In some cases, hypersensitive reactions can be triggered by exposures to allergens through skin contact, inhalation, kissing, participation in sports, blood transfusions, cosmetics, and alcohol.",0
" Inhalation exposure Allergic reactions to airborne particles or vapors of known food allergens have been reported as an occupational consequence of people working in the food industry, but can also take place in home situations, restaurants, or confined spaces such as airplanes.",0
"According to two reviews, respiratory symptoms are common, but in some cases there has been progression to anaphylaxis.",0
"The most frequent reported cases of reactions by inhalation of allergenic foods were due to peanut, seafood, legumes, tree nut, and cow's milk.",0
"Steam rising from cooking of lentils, green beans, chickpeas and fish has been well documented as triggering reactions, including anaphylactic reactions.",0
"One review mentioned case study examples of allergic responses to inhalation of other foods, including examples in which oral consumption of the food is tolerated.",0
 Treatment The mainstay of treatment for food allergy is total avoidance of the foods identified as allergens.,0
" An allergen can enter the body by consuming a food containing the allergen, and can also be ingested by touching any surfaces that may have come into contact with the allergen, then touching the eyes or nose.",0
"For people who are extremely sensitive, avoidance includes avoiding touching or inhaling the problematic food.",0
Total avoidance is complicated because the declaration of the presence of trace amounts of allergens in foods is not mandatory (see regulation of labelling).,0
"If the food is accidentally ingested and a systemic reaction (anaphylaxis) occurs, then epinephrine should be used.",0
A second dose of epinephrine may be required for severe reactions.,0
" The person should then be transported to the emergency room, where additional treatment can be given.",0
 Other treatments include antihistamines and steroids.,0
 Epinephrine Epinephrine (adrenaline) is the first-line treatment for severe allergic reactions (anaphylaxis).,0
"If administered in a timely manner, epinephrine can reverse its effects.",0
"Epinephrine relieves airway swelling and obstruction, and improves blood circulation; blood vessels are tightened and heart rate is increased, improving circulation to body organs.",0
 Epinephrine is available by prescription in an autoinjector.,0
" Antihistamines Antihistamines can alleviate some of the milder symptoms of an allergic reaction, but do not treat all symptoms of anaphylaxis.",0
" Antihistamines block the action of histamine, which causes blood vessels to dilate and become leaky to plasma proteins.",0
Histamine also causes itchiness by acting on sensory nerve terminals.,0
 The most common antihistamine given for food allergies is diphenhydramine.,0
 Steroids Glucocorticoid steroids are used to calm down the immune system cells that are attacked by the chemicals released during an allergic reaction.,0
" This treatment in the form of a nasal spray should not be used to treat anaphylaxis, for it only relieves symptoms in the area in which the steroid is in contact.",0
 Another reason steroids should not be used is the delay in reducing inflammation.,0
" Steroids can also be taken orally or through injection, by which every part of the body can be reached and treated, but a long time is usually needed for these to take effect.",0
" Epidemiology The most common food allergens account for about 90% of all allergic reactions; in adults they include shellfish, peanuts, tree nuts, fish, and egg.",0
"In children, they include milk, eggs, peanuts, and tree nuts.",0
"Six to 8% of children under the age of three have food allergies and nearly 4% of adults have food allergies.For reasons not entirely understood, the diagnosis of food allergies has apparently become more common in Western nations recently.",0
"One possible explanation for this is the old friends hypothesis which suggests that non disease causing organisms, such as helminths, could protect against allergy.",0
"Therefore, reduced exposure to these organisms, particularly in developed countries, could have contributed towards the increase.In the United States, food allergy affects as many as 5% of infants less than three years of age and 3% to 4% of adults.",0
"A similar prevalence is found in Canada.About 75% of children who have allergies to milk protein are able to tolerate baked-in milk products, i.e., muffins, cookies, cake, and hydrolyzed formulas.About 50% of children with allergies to milk, egg, soy, peanuts, tree nuts, and wheat will outgrow their allergy by the age of 6.",0
"Those who are still allergic by the age of 12 or so have less than an 8% chance of outgrowing the allergy.Peanut and tree nut allergies are less likely to be outgrown, although evidence now shows that about 20% of those with peanut allergies and 9% of those with tree nut allergies will outgrow them.In Japan, allergy to buckwheat flour, used for soba noodles, is more common than peanuts, tree nuts or foods made from soy beans.",0
" United States In the United States, an estimated 12 million people have food allergies.",0
Food allergy affects as many as 5% of infants less than three years of age and 3% to 4% of adults.,0
The prevalence of food allergies is rising.,0
"Food allergies cause roughly 30,000 emergency room visits and 150 deaths per year.",0
" Society and culture Whether rates of food allergy are increasing or not, food allergy awareness has definitely increased, with impacts on the quality of life for children, their parents and their caregivers.",0
"In the United States, the Food Allergen Labeling and Consumer Protection Act of 2004 causes people to be reminded of allergy problems every time they handle a food package, and restaurants have added allergen warnings to menus.",0
"The Culinary Institute of America, a premier school for chef training, has courses in allergen-free cooking and a separate teaching kitchen.",0
School systems have protocols about what foods can be brought into the school.,0
"Despite all these precautions, people with serious allergies are aware that accidental exposure can easily occur at other peoples' houses, at school or in restaurants.",0
Food fear has a significant impact on quality of life.,0
"For children with allergies, their quality of life is also affected by actions of their peers.",0
"There is an increased occurrence of bullying, which can include threats or acts of deliberately being touched with foods they need to avoid, also having their allergen-free food deliberately contaminated.",0
"In the 2018 animated/live action movie Peter Rabbit, rabbits used blackberries to deliberately induce an anaphylactic allergy response in a farmer who is trying to protect his garden.",0
"After many public protests, Sony Pictures and the director apologized for making light of food allergies.",0
" Regulation of labelling In response to the risk that certain foods pose to those with food allergies, some countries have responded by instituting labeling laws that require food products to clearly inform consumers if their products contain priority allergens or byproducts of major allergens among the ingredients intentionally added to foods.",0
 The priority allergens vary by country.,0
" There are no labeling laws mandating declaration of the presence of trace amounts in the final product as a consequence of cross-contamination, except in Brazil.",0
" Ingredients intentionally added In the United States, the Food Allergen Labeling and Consumer Protection Act of 2004 (FALCPA) requires companies to disclose on the label whether a packaged food product contains any of these eight major food allergens, added intentionally: cow's milk, peanuts, eggs, shellfish, fish, tree nuts, soy and wheat.",0
(In October 2018 the US FDA issued a request for information for the consideration of labeling for sesame to help protect people who have sesame allergies.) The eight-ingredient is list originated in 1999 from the World Health Organisation Codex Alimentarius Commission.,0
"To meet FALCPA labeling requirements, if an ingredient is derived from one of the required-label allergens, then it must either have its food sourced name in parentheses, for example Casein (milk), or as an alternative, there must be a statement separate but adjacent to the ingredients list: Contains milk (and any other of the allergens with mandatory labeling).",0
"The European Union requires listing for those eight major allergens plus molluscs, celery, mustard, lupin, sesame and sulfites.FALCPA applies to packaged foods regulated by the FDA, which does not include poultry, most meats, certain egg products, and most alcoholic beverages.",0
"However, some meat, poultry, and egg processed products may contain allergenic ingredients.",0
"These products are regulated by the Food Safety and Inspection Service (FSIS), which requires that any ingredient be declared in the labeling only by its common or usual name.",0
"Neither the identification of the source of a specific ingredient in a parenthetical statement nor the use of statements to alert for the presence of specific ingredients, like Contains: milk, are mandatory according to FSIS.",0
 FALCPA also does not apply to food prepared in restaurants.,0
"The EU Food Information for Consumers Regulation 1169/2011 ‚Äì requires food businesses to provide allergy information on food sold unpackaged, for example, in catering outlets, deli counters, bakeries and sandwich bars.In the United States, there is no federal mandate to address the presence of allergens in drug products.",0
FALCPA does not apply to medicines nor to cosmetics.,0
 Trace amounts as a result of cross-contamination The value of allergen labeling other than for intentional ingredients is controversial.,0
"This concerns labeling for ingredients present unintentionally as a consequence of cross-contact or cross-contamination at any point along the food chain (during raw material transportation, storage or handling, due to shared equipment for processing and packaging, etc.).",0
"Experts in this field propose that if allergen labeling is to be useful to consumers, and healthcare professionals who advise and treat those consumers, ideally there should be agreement on which foods require labeling, threshold quantities below which labeling may be of no purpose, and validation of allergen detection methods to test and potentially recall foods that were deliberately or inadvertently contaminated.Labeling regulations have been modified to provide for mandatory labeling of ingredients plus voluntary labeling, termed precautionary allergen labeling (PAL), also known as ‚Äúmay contain‚Äù statements, for possible, inadvertent, trace amount, cross-contamination during production.",0
"PAL labeling can be confusing to consumers, especially as there can be many variations on the wording of the warning.",0
PAL is optional in the United States.,0
"As of 2014, PAL is regulated only in Switzerland, Japan, Argentina, and South Africa.",0
"Argentina decided to prohibit precautionary allergen labeling since 2010, and instead puts the onus on the manufacturer to control the manufacturing process and label only those allergenic ingredients known to be in the products.",0
"South Africa does not permit the use of PAL, except when manufacturers demonstrate the potential presence of allergen due to cross-contamination through a documented risk assessment and despite adherence to Good Manufacturing Practice.",0
In Australia and New Zealand there is a recommendation that PAL be replaced by guidance from VITAL 2.0 (Vital Incidental Trace Allergen Labeling).,0
A review identified the eliciting dose for an allergic reaction in 1% of the population as ED01.,0
"This threshold reference dose for foods (such as cow's milk, egg, peanut and other proteins) will provide food manufacturers with guidance for developing precautionary labeling and give consumers a better idea of might be accidentally in a food product beyond may contain.",0
"VITAL 2.0 was developed by the Allergen Bureau, a food industry sponsored, non-government organization.",0
"The European Union has initiated a process to create labeling regulations for unintentional contamination but is not expected to publish such before 2024.In Brazil, since April 2016, the declaration of the possibility of cross-contamination is mandatory when the product does not intentionally add any allergenic food or its derivatives, but the Good Manufacturing Practices and allergen control measures adopted are not sufficient to prevent the presence of accidental trace amounts.",0
"These allergens include wheat, rye, barley, oats and their hybrids, crustaceans, eggs, fish, peanuts, soybean, milk of all species of mammalians, almonds, hazelnuts, cashew nuts, Brazil nuts, macadamia nuts, walnuts, pecan nuts, pistachios, pine nuts, and chestnuts.",0
" Genetically modified food There are concerns that genetically modified foods, also described as foods sourced from genetically modified organisms (GMO), could be responsible for allergic reactions, and that the widespread acceptance of GMO foods may be responsible for what is a real or perceived increase in the percentage of people with allergies.",0
There is a scientific consensus that available food derived from GM crops poses no greater risk to human health than conventional food.,0
A 2016 U.S.,0
"National Academy of Sciences report concluded that there is no relationship between consumption of GM foods and the increase in prevalence of food allergies.One concern is that genetic engineering could make an allergy-provoking food more allergic, meaning that smaller portions would suffice to set off a reaction.",0
"Of the food currently in widespread GMO use, only soybeans are identified as a common allergen.",0
"However, for the soybean proteins known to trigger allergic reactions, there is more variation from strain to strain than between those and the GMO varieties.",0
Another concern is that genes transferred from one species to another could introduce an allergen in a food not thought of as particularly allergenic.,0
"Research on an attempt to enhance the quality of soybean protein by adding genes from Brazil nuts was terminated when human volunteers known to have tree nut allergy reacted to the modified soybeans.Prior to a new GMO food receiving government approval, certain criteria need to be met.",0
These include: Is the donor species known to be allergenic.,0
Does the amino acid sequence of the transferred proteins resemble the sequence of known allergenic proteins.,0
Are the transferred proteins resistant to digestion - a trait shared by many allergenic proteins.,0
Genes approved for animal use can be restricted from human consumption due to potential for allergic reactions.,0
"In 1998 Starlink brand corn restricted to animals was detected in the human food supply, leading to first a voluntary and then a FDA mandated recall.",0
"There are requirements in some countries and recommendations in others that all foods containing GMO ingredients be so labeled, and that there be a post-launch monitoring system to report adverse effects (much there exists in some countries for drug and dietary supplement reporting).",0
"In the US, the FDA Food Code states that the person in charge in restaurants should have knowledge about major food allergens, cross-contacts, and symptoms of food allergy reactions.",0
Ankylosing spondylitis (AS) is a type of arthritis in which there is a long-term inflammation of the joints of the spine.,0
Typically the joints where the spine joins the pelvis are also affected.,0
Occasionally other joints such as the shoulders or hips are involved.,0
Eye and bowel problems may also occur.,0
"Back pain is a characteristic symptom of AS, and it often comes and goes.",0
"Stiffness of the affected joints generally worsens over time.Although the cause of ankylosing spondylitis is unknown, it is believed to involve a combination of genetic and environmental factors.",0
More than 85% of those affected in the UK have a specific human leukocyte antigen known as the HLA-B27 antigen.,0
The underlying mechanism is believed to be autoimmune or autoinflammatory.,0
Diagnosis is typically based on the symptoms with support from medical imaging and blood tests.,0
"AS is a type of seronegative spondyloarthropathy, meaning that tests show no presence of rheumatoid factor (RF) antibodies.",0
It is also within a broader category known as axial spondyloarthritis.There is no cure for ankylosing spondylitis.,0
Treatments may improve symptoms and prevent worsening.,0
"This may include medication, exercise, physical therapy, surgery in rare cases.",0
"Medications used include NSAIDs, steroids, DMARDs such as sulfasalazine, and biologic agents such as TNF inhibitors.Between 0.1% and 1.8% of people are affected.",0
Onset is typically in young adults.,0
Males and females are equally affected.,0
It used to be thought that three times as many men as women had the disease.,0
This was based on a diagnosis of the disease using x-ray.,0
"Men are more likely than women to experience changes to the bones and fusion, and thus they were being picked up using x-ray.",0
Over time MRI‚Äôs were developed which could identify inflammation.,0
Women are more likely than men to experience inflammation rather than fusion.,0
"source  The condition was first fully described in the late 1600s by Bernard Connor, but skeletons with ankylosing spondylitis are found in Egyptian mummies.",0
"The word is from Greek ankylos meaning to unite or grow together, spondylos meaning vertebra, and -itis meaning inflammation.",0
" Signs and symptoms The signs and symptoms of ankylosing spondylitis often appear gradually, with peak onset being between 20 and 30 years of age.",0
Initial symptoms are usually a chronic dull pain in the lower back or gluteal region combined with stiffness of the lower back.,0
"Individuals often experience pain and stiffness that awakens them in the early morning hours.As the disease progresses, loss of spinal mobility and chest expansion, with a limitation of anterior flexion, lateral flexion, and extension of the lumbar spine, are seen.",0
"Systemic features are common, with weight loss, fever, or fatigue often present.",0
"Pain is often severe at rest but may improve with physical activity, but inflammation and pain to varying degrees may recur regardless of rest and movement.",0
"AS can occur in any part of the spine or the entire spine, often with pain referred to one or the other buttock or the back of the thigh from the sacroiliac joint.",0
 Arthritis in the hips and shoulders may also occur.,0
"When the condition presents before the age of 18, it is more likely to cause pain and swelling of large lower limb joints, such as the knees.",0
"In prepubescent cases, pain and swelling may also manifest in the ankles and feet where heel pain and enthesopathy commonly develop.",0
"Less commonly ectasia of the sacral nerve root sheaths may occur.About 30% of people with AS will also experience anterior uveitis, causing eye pain, redness, and blurred vision.",0
This is thought to be due to the association that both AS and uveitis have with the inheritance of the HLA-B27 antigen.,0
"Cardiovascular involvement may include inflammation of the aorta, aortic valve insufficiency or disturbances of the heart's electrical conduction system.",0
Lung involvement is characterized by progressive fibrosis of the upper portion of the lung.,0
" Pathophysiology Ankylosing spondylitis (AS) is a systemic rheumatic disease, meaning it affects the entire body.",0
1‚Äì2% of individuals with the HLA-B27 genotype develop the disease.,0
"Approximately 85% of people with AS express the HLA-B27 genotype, meaning there is a strong genetic association.",0
Tumor necrosis factor-alpha (TNF Œ±) and IL-1 are also implicated in ankylosing spondylitis.,0
Autoantibodies specific for AS have not been identified.,0
"Anti-neutrophil cytoplasmic antibodies (ANCAs) are associated with AS, but do not correlate with disease severity.Single nucleotide polymorphism (SNP) A/G variant rs10440635 close to the PTGER4 gene on human chromosome 5 has been associated with an increased number of cases of ankylosing spondylitis in a population recruited from the United Kingdom, Australia, and Canada.",0
"The PTGER4 gene codes for the prostaglandin EP4 receptor (EP4), one of four receptors for prostaglandin E2.",0
"Activation of EP4 promotes bone remodeling and deposition (see EP4, bone) and EP4 is highly expressed at vertebral column sites involved in ankylosing spondylitis.",0
"These findings suggest that excessive EP4 activation contributes to pathological bone remodeling and deposition in ankylosing spondylitis and that the A/G variant rs10440635a of PTGER4 predisposes to this disease, possibly by influencing EP4's production or expression pattern.The association of AS with HLA-B27 suggests the condition involves CD8 T cells, which interact with HLA-B.",0
