text,label
"A type of dermatitis may be described by location (e.g., hand eczema), by specific appearance (eczema craquele or discoid) or by possible cause (varicose eczema).",0
"Further adding to the confusion, many sources use the term eczema interchangeably for the most common type: atopic dermatitis.",0
"The European Academy of Allergology and Clinical Immunology (EAACI) published a position paper in 2001, which simplifies the nomenclature of allergy-related diseases, including atopic and allergic contact eczemas.",0
Non-allergic eczemas are not affected by this proposal.,0
" Histopathologic classification By histopathology, superficial dermatitis (in the epidermis, papillary dermis, and superficial vascular plexus) can basically be classified into either of the following groups: Vesiculobullous lesions Pustular dermatosis Non vesicullobullous, non-pustularWith epidermal changes Without epidermal changes.",0
"These characteristically have a superficial perivascular inflammatory infiltrate, and can be classified by type of cell infiltrate:Lymphocytic (most common) Lymphoeosinophilic Lymphoplasmacytic Mast cell Lymphohistiocytic Neutrophilic Terminology There are several types of dermatitis including atopic dermatitis, contact dermatitis, stasis dermatitis and seborrheic eczema.",0
Many use the term dermatitis and eczema synonymously.Others use the term eczema to specifically mean atopic dermatitis.,0
Atopic dermatitis is also known as atopic eczema.,0
"In some languages, dermatitis and eczema mean the same thing, while in other languages dermatitis implies an acute condition and eczema a chronic one.",0
 Common types Diagnosis of types may be indicated by codes defined according to International Statistical Classification of Diseases and Related Health Problems (ICD).,0
 Atopic Atopic dermatitis is an allergic disease believed to have a hereditary component and often runs in families whose members have asthma.,0
"Itchy rash is particularly noticeable on head and scalp, neck, inside of elbows, behind knees, and buttocks.",0
It is very common in developed countries and rising.,0
Irritant contact dermatitis is sometimes misdiagnosed as atopic dermatitis.,0
Stress can cause atopic dermatitis to worsen.,0
" Contact Contact dermatitis is of two types: allergic (resulting from a delayed reaction to an allergen, such as poison ivy, nickel, or Balsam of Peru), and irritant (resulting from direct reaction to a detergent, such as sodium lauryl sulfate, for example).",0
"Some substances act both as allergen and irritant (wet cement, for example).",0
"Other substances cause a problem after sunlight exposure, bringing on phototoxic dermatitis.",0
"About three quarters of cases of contact eczema are of the irritant type, which is the most common occupational skin disease.",0
"Contact eczema is curable, provided the offending substance can be avoided and its traces removed from one's environment.",0
(ICD-10 L23; L24; L56.1; L56.0) Seborrhoeic Seborrhoeic dermatitis or seborrheic dermatitis (cradle cap in infants) is a condition sometimes classified as a form of eczema that is closely related to dandruff.,0
"It causes dry or greasy peeling of the scalp, eyebrows, and face, and sometimes trunk.",0
"In newborns, it causes a thick, yellow, crusty scalp rash called cradle cap, which seems related to lack of biotin and is often curable.",0
"(ICD-10 L21; L21.0) Less common types Dyshidrosis Dyshidrosis (dyshidrotic eczema, pompholyx, vesicular palmoplantar dermatitis) only occurs on palms, soles, and sides of fingers and toes.",0
"Tiny opaque bumps called vesicles, thickening, and cracks are accompanied by itching, which gets worse at night.",0
"A common type of hand eczema, it worsens in warm weather.",0
"(ICD-10 L30.1) Discoid Discoid eczema (nummular eczema, exudative eczema, microbial eczema) is characterized by round spots of oozing or dry rash, with clear boundaries, often on lower legs.",0
It is usually worse in winter.,0
"Cause is unknown, and the condition tends to come and go.",0
"(ICD-10 L30.0) Venous Venous eczema (gravitational eczema, stasis dermatitis, varicose eczema) occurs in people with impaired circulation, varicose veins, and edema, and is particularly common in the ankle area of people over 50.",0
"There is redness, scaling, darkening of the skin, and itching.",0
The disorder predisposes to leg ulcers.,0
"(ICD-10 I83.1) Herpetiformis Dermatitis herpetiformis (Duhring's disease) causes an intensely itchy and typically symmetrical rash on arms, thighs, knees, and back.",0
"It is directly related to celiac disease, can often be put into remission with an appropriate diet, and tends to get worse at night.",0
"(ICD-10 L13.0) Neurodermatitis Neurodermatitis (lichen simplex chronicus, localized scratch dermatitis) is an itchy area of thickened, pigmented eczema patch that results from habitual rubbing and scratching.",0
"Usually, there is only one spot.",0
Often curable through behaviour modification and anti-inflammatory medication.,0
Prurigo nodularis is a related disorder showing multiple lumps.,0
"(ICD-10 L28.0; L28.1) Autoeczematization Autoeczematization (id reaction, auto sensitization) is an eczematous reaction to an infection with parasites, fungi, bacteria, or viruses.",0
It is completely curable with the clearance of the original infection that caused it.,0
The appearance varies depending on the cause.,0
It always occurs some distance away from the original infection.,0
"(ICD-10 L30.2) Viral There are eczemas overlaid by viral infections (eczema herpeticum or vaccinatum), and eczemas resulting from underlying disease (e.g., lymphoma).",0
"Eczemas originating from ingestion of medications, foods, and chemicals, have not yet been clearly systematized.",0
Other rare eczematous disorders exist in addition to those listed here.,0
 Prevention Only breastfeeding during at least the first few months may decrease the risk.,0
There is no good evidence that a mother's diet during pregnancy or breastfeeding affects the risk.,0
Nor is there evidence that delayed introduction of certain foods is useful.,0
There is tentative evidence that probiotics in infancy may reduce rates but it is insufficient to recommend its use.Certain military and healthcare personnel who might come into contact with the smallpox are still vaccinated against the virus.,0
"Those who also have eczema should not receive the smallpox vaccination due to risk of developing eczema vaccinatum, a potentially severe and sometimes fatal complication.",0
" Management There is no known cure for some types of dermatitis, with treatment aiming to control symptoms by reducing inflammation and relieving itching.",0
Contact dermatitis is treated by avoiding what is causing it.,0
" Lifestyle Bathing once or more a day is recommended, usually for five to ten minutes in warm water.",0
Soaps should be avoided as they tend to strip the skin of natural oils and lead to excessive dryness.,0
The American Academy of Dermatology suggests using a controlled amount of bleach diluted in a bath to help with atopic dermatitis.There has not been adequate evaluation of changing the diet to reduce eczema.,0
There is some evidence that infants with an established egg allergy may have a reduction in symptoms if eggs are eliminated from their diets.,0
"Benefits have not been shown for other elimination diets, though the studies are small and poorly executed.",0
"Establishing that there is a food allergy before dietary change could avoid unnecessary lifestyle changes.People can wear clothing designed to manage the itching, scratching and peeling.House dust mite reduction and avoidance measures have been studied in low quality trials and have not shown evidence of improving eczema.",0
 Moisturizers Low-quality evidence indicates that moisturizing agents (emollients) may reduce eczema severity and lead to fewer flares.,0
"In children, oil‚Äìbased formulations appear to be better and water‚Äìbased formulations are not recommended.",0
It is unclear if moisturizers that contain ceramides are more or less effective than others.,0
"Products that contain dyes, perfumes, or peanuts should not be used.",0
"Occlusive dressings at night may be useful.Some moisturizers or barrier creams may reduce irritation in occupational irritant hand dermatitis, a skin disease that can affect people in jobs that regularly come into contact with water, detergents, chemicals or other irritants.",0
Some emollients may reduce the number of flares in people with dermatitis.,0
" Medications Corticosteroids If symptoms are well controlled with moisturizers, steroids may only be required when flares occur.",0
Corticosteroids are effective in controlling and suppressing symptoms in most cases.,0
Once daily use is generally enough.,0
"For mild-moderate eczema a weak steroid may be used (e.g., hydrocortisone), while in more severe cases a higher-potency steroid (e.g., clobetasol propionate) may be used.",0
"In severe cases, oral or injectable corticosteroids may be used.",0
"While these usually bring about rapid improvements, they have greater side effects.",0
"Long term use of topical steroids may result in skin atrophy, stria, telangiectasia.",0
Their use on delicate skin (face or groin) is therefore typically with caution.,0
"They are, however, generally well tolerated.",0
"Red burning skin, where the skin turns red upon stopping steroid use, has been reported among adults who use topical steroids at least daily for more than a year.",0
 Antihistamines There is little evidence supporting the efficacy of antihistamine for the relief of dermatitis.,0
"Sedative antihistamines, such as diphenhydramine, may be useful in those who are unable to sleep due to eczema.",0
Second generation antihistamines have minimal evidence of benefit.,0
"Of the second generation antihistamines studied, fexofenadine is the only one to show evidence of improvement in itching with minimal side effects.",0
 Immunosuppressants Topical immunosuppressants like pimecrolimus and tacrolimus may be better in the short term and appear equal to steroids after a year of use.,0
Their use is reasonable in those who do not respond to or are not tolerant of steroids.,0
Treatments are typically recommended for short or fixed periods of time rather than indefinitely.,0
"Tacrolimus 0.1% has generally proved more effective than pimecrolimus, and equal in effect to mid-potency topical steroids.",0
"There is no link to increased risk of cancer from topical use of 1% pimecrolimus cream.When eczema is severe and does not respond to other forms of treatment, systemic immunosuppressants are sometimes used.",0
Immunosuppressants can cause significant side effects and some require regular blood tests.,0
"The most commonly used are ciclosporin, azathioprine, and methotrexate.",0
 Light therapy Light therapy using ultraviolet light has tentative support but the quality of the evidence is not very good.,0
"A number of different types of light may be used including UVA and UVB; in some forms of treatment, light sensitive chemicals such as psoralen are also used.",0
"Overexposure to ultraviolet light carries its own risks, particularly that of skin cancer.",0
 Alternative medicine Limited evidence suggests that acupuncture may reduce itching in those affected by atopic dermatitis.,0
There is currently no scientific evidence for the claim that sulfur treatment relieves eczema.,0
It is unclear whether Chinese herbs help or harm.,0
Dietary supplements are commonly used by people with eczema.,0
Neither evening primrose oil nor borage seed oil taken orally have been shown to be effective.,0
Both are associated with gastrointestinal upset.,0
Probiotics are likely to make little to no difference in symptoms.,0
"There is insufficient evidence to support the use of zinc, selenium, vitamin D, vitamin E, pyridoxine (vitamin B6), sea buckthorn oil, hempseed oil, sunflower oil, or fish oil as dietary supplements.Chiropractic spinal manipulation lacks evidence to support its use for dermatitis.",0
There is little evidence supporting the use of psychological treatments.,0
While dilute bleach baths have been used for infected dermatitis there is little evidence for this practice.,0
 Prognosis Most cases are well managed with topical treatments and ultraviolet light.,0
About 2% of cases are not.,0
"In more than 60% of young children, the condition subsides by adolescence.",0
 Epidemiology Globally dermatitis affected approximately 230 million people as of 2010 (3.5% of the population).,0
"Dermatitis is most commonly seen in infancy, with female predominance of eczema presentations occurring during the reproductive period of 15‚Äì49 years.",0
"In the UK about 20% of children have the condition, while in the United States about 10% are affected.Although little data on the rates of eczema over time exists prior to the 1940s, the rate of eczema has been found to have increased substantially in the latter half of the 20th century, with eczema in school-aged children being found to increase between the late 1940s and 2000.",0
In the developed world there has been rise in the rate of eczema over time.,0
 The incidence and lifetime prevalence of eczema in England has been seen to increase in recent times.Dermatitis affected about 10% of U.S.,0
"workers in 2010, representing over 15 million workers with dermatitis.",0
"Prevalence rates were higher among females than among males, and among those with some college education or a college degree compared to those with a high school diploma or less.",0
"Workers employed in healthcare and social assistance industries and life, physical, and social science occupations had the highest rates of reported dermatitis.",0
About 6% of dermatitis cases among U.S.,0
"workers were attributed to work by a healthcare professional, indicating that the prevalence rate of work-related dermatitis among workers was at least 0.6%.",0
"Telangiectasias, also known as spider veins, are small dilated blood vessels that can occur near the surface of the skin or mucous membranes, measuring between 0.5 and 1 millimeter in diameter.",0
"These dilated blood vessels can develop anywhere on the body but are commonly seen on the face around the nose, cheeks and chin.",0
"Dilated blood vessels can also develop on the legs, although when they occur on the legs, they often have underlying venous reflux or hidden varicose veins (see Venous hypertension section below).",0
"When found on the legs, they are found specifically on the upper thigh, below the knee joint and around the ankles.",0
Many patients who suffer with spider veins seek the assistance of physicians who specialize in vein care or peripheral vascular disease.,0
These physicians are called vascular surgeons or phlebologists.,0
"More recently, interventional radiologists have started treating venous problems.",0
Some telangiectasias are due to developmental abnormalities that can closely mimic the behaviour of benign vascular neoplasms.,0
"They may be composed of abnormal aggregations of arterioles, capillaries or venules.",0
"Because telangiectasias are vascular lesions, they blanch when tested with diascopy.",0
"Telangiectasias, aside from presenting in many other conditions, are one of the features of the acronymically named CREST syndrome, a form of systemic scleroderma.",0
"The syndrome recognises the significantly co-presenting symptoms of calcinosis, Raynaud's phenomenon, esophageal dysmotility, sclerodactyly and telangiectasia.",0
 Causes The causes of telangiectasia can be divided into congenital and acquired factors.,0
 Genetic Goldman states that numerous inherited or congenital conditions display cutaneous telangiectasia.,0
These include:  Bloom syndrome (homozygous null mutation in BLM DNA repair enzyme.,0
"similar mechanism and etiology to ataxia telangiectasia) Naevus flammeus (port-wine stain) Klippel‚ÄìTrenaunay syndrome Maffucci syndrome (multiple enchondromas and hemangiomas) Hereditary hemorrhagic telangiectasia (Osler‚ÄìWeber‚ÄìRendu syndrome) Ataxia‚Äìtelangiectasia Sturge‚ÄìWeber syndrome, a nevus formation in the skin supplied by the trigeminal nerve and associated with facial port-wine stains, glaucoma, meningeal angiomas and intellectual disabilities Hypotrichosis‚Äìlymphedema‚Äìtelangiectasia syndrome, caused by mutation in transcription factor SOX18 Venous hypertension In the past, it was believed that leg varicose veins or telangectasia were caused by high venous pressure or venous hypertension.",0
However it is now understood that venous reflux disease is usually the cause of these problems.Telangiectasia in the legs is often related to the presence of venous reflux within underlying varicose veins.,0
Flow abnormalities within the medium-sized veins of the leg (reticular veins) can also lead to the development of telangiectasia.,0
Factors that predispose to the development of varicose and telangiectatic leg veins include  Age Gender: It used to be thought that females were affected far more than males.,0
"However, research has shown 79% of adult males and 88% of adult females have leg telangectasia (spider veins).",0
Pregnancy: Pregnancy is a key factor contributing to the formation of varicose and spider veins.,0
The most important factor is circulating hormones that weaken vein walls.,0
"There's also a significant increase in the blood volume during pregnancy, which tends to distend veins, causing valve dysfunction which leads to blood pooling in the veins.",0
"Moreover, later in pregnancy, the enlarged uterus can compress veins, causing higher vein pressure leading to dilated veins.",0
Varicose veins that form during pregnancy may spontaneously improve or even disappear a few months after delivery.,0
Lifestyle/occupation: Those who are involved with prolonged sitting or standing in their daily activities have an increased risk of developing varicose veins.,0
"The weight of the blood continuously pressing against the closed valves causes them to fail, leading to vein distention.",0
" Other acquired causes Acquired telangiectasia, not related to other venous abnormalities, for example on the face and trunk, can be caused by factors such as  Cushing's syndrome Acne rosacea Blepharitis Environmental damage such as that caused by sun or cold exposure Age Trauma to skin such as contusions or surgical incisions.",0
"Radiation exposure such as that experienced during radiotherapy for the treatment of cancer, e.g., radiation proctitis Chemotherapy Carcinoid syndrome Limited systemic sclerosis/scleroderma (a Scleroderma sub-type) Chronic treatment with topical corticosteroids may lead to telangiectasia.",0
Spider angiomas are a radial array of tiny arterioles that commonly occur in pregnant women and in patients with hepatic cirrhosis and are associated with palmar erythema.,0
" In men, they are related to high estrogen levels secondary to liver disease.",0
"Tempi syndrome Tobacco smoking Treatment Before any treatment of leg telangectasia (spider veins) is considered, it is essential to have duplex ultrasonography, the test that has replaced Doppler ultrasound.",0
The reason for this is that there is a clear association between leg telangectasia (spider veins) and underlying venous reflux.,0
"Research has shown that 88-89% of women with telangectasia (spider veins) have refluxing reticular veins close, and 15% have incompetent perforator veins nearby.",0
"As such, it is essential to both find and treat underlying venous reflux before considering any treatment at all.",0
Sclerotherapy is the gold standard and is preferred over laser for eliminating telangiectasiae and smaller varicose leg veins.,0
A sclerosant medication is injected into the diseased vein so it hardens and eventually shrinks away.,0
"Recent evidence with foam sclerotherapy shows that the foam containing the irritating sclerosant quickly appears in the patient's heart and lungs, and then in some cases travels through a patent foramen ovale to the brain.",0
This has led to concerns about the safety of sclerotherapy for telangectasias and spider veins.,0
In some cases stroke and transient ischemic attacks have occurred after sclerotherapy.,0
"Varicose veins and reticular veins are often treated before treating telangiectasia, although treatment of these larger veins in advance of sclerotherapy for telangiectasia may not guarantee better results.",0
"Varicose veins can be treated with foam sclerotherapy, endovenous laser treatment, radiofrequency ablation, or open surgery.",0
" The biggest risk, however, seems to occur with sclerotherapy, especially in terms of systemic risk of DVT, pulmonary embolism, and stroke.Other issues which arise with the use of sclerotherapy to treat spider veins are staining, shadowing, telangetatic matting, and ulceration.",0
" In addition, incompleteness of therapy is common, requiring multiple treatment sessions.Telangiectasias on the face are often treated with a laser.",0
"Laser therapy uses a light beam that is pulsed onto the veins in order to seal them off, causing them to dissolve.",0
These light-based treatments require adequate heating of the veins.,0
" These treatments can result in the destruction of sweat glands, and the risk increases with the number of treatments.",0
Wilson's disease is a genetic disorder in which excess copper builds up in the body.,0
Symptoms are typically related to the brain and liver.,0
"Liver-related symptoms include vomiting, weakness, fluid build up in the abdomen, swelling of the legs, yellowish skin and itchiness.",0
"Brain-related symptoms include tremors, muscle stiffness, trouble speaking, personality changes, anxiety and seeing or hearing things that others do not.Wilson's disease is caused by a mutation in the Wilson disease protein (ATP7B) gene.",0
"This protein transports excess copper into bile, where it is excreted in waste products.",0
"The condition is autosomal recessive; for a person to be affected, they must inherit a mutated copy of the gene from both parents.",0
"Diagnosis may be difficult and often involves a combination of blood tests, urine tests and a liver biopsy.",0
Genetic testing may be used to screen family members of those affected.Wilson's disease is typically treated with dietary changes and medication.,0
Dietary changes involve eating a low-copper diet and not using copper cookware.,0
Medications used include chelating agents such as trientine and d-penicillamine and zinc supplements.,0
"Complications of Wilson's disease can include liver failure, liver cancer and kidney problems.",0
"A liver transplant may be helpful in those in whom other treatments are not effective or if liver failure occurs.Wilson's disease occurs in about 1 in 30,000 people.",0
Symptoms usually begin between the ages of 5 and 35 years.,0
It was first described in 1854 by German pathologist Friedrich Theodor von Frerichs and is named after British neurologist Samuel Wilson.,0
" Signs and symptoms The main sites of copper accumulation are the liver and the brain, and consequently liver disease and neuropsychiatric symptoms are the main features that lead to diagnosis.",0
"People with liver problems tend to come to medical attention earlier, generally as children or teenagers, than those with neurological and psychiatric symptoms, who tend to be in their twenties or older.",0
"Some are identified only because relatives have been diagnosed with Wilson's disease; many of these, when tested, turn out to have been experiencing symptoms of the condition but have not received a diagnosis.",0
" Liver disease Liver disease may present itself as tiredness, increased bleeding tendency or confusion (due to hepatic encephalopathy) and portal hypertension.",0
"The latter, a condition in which the pressure in the portal vein is markedly increased, leads to esophageal varices, blood vessels in the esophagus that may bleed in a life-threatening fashion, as well as enlargement of the spleen (splenomegaly) and accumulation of fluid in the abdominal cavity (ascites).",0
"On examination, signs of chronic liver disease such as spider angiomata (small distended blood vessels, usually on the chest) may be observed.",0
Chronic active hepatitis has caused cirrhosis of the liver in most by the time they develop symptoms.,0
"While most people with cirrhosis have an increased risk of hepatocellular carcinoma (liver cancer), this risk is relatively very low in Wilson's disease.About 5% of all people are diagnosed only when they develop fulminant acute liver failure, often in the context of a hemolytic anemia (anemia due to the destruction of red blood cells).",0
This leads to abnormalities in protein production (identified by deranged coagulation) and metabolism by the liver.,0
The deranged protein metabolism leads to the accumulation of waste products such as ammonia in the bloodstream.,0
"When these irritate the brain, the person develops hepatic encephalopathy (confusion, coma, seizures and finally life-threatening swelling of the brain).",0
 Neuropsychiatric symptoms About half the people with Wilson's disease have neurological or psychiatric symptoms.,0
"Most initially have mild cognitive deterioration and clumsiness, as well as changes in behavior.",0
"Specific neurological symptoms usually then follow, often in the form of parkinsonism (cogwheel rigidity, bradykinesia or slowed movements and a lack of balance are the most common parkinsonian features) with or without a typical hand tremor, masked facial expressions, slurred speech, ataxia (lack of coordination) or dystonia (twisting and repetitive movements of part of the body).",0
Seizures and migraine appear to be more common in Wilson's disease.,0
